Nosaukums,Reģistrācijas numurs,Juridiskais status,Vadītājs,Filiāļu skaits,Strukturvienību skaits,Veids,Tips,Faktiskais dibinātājs,Deklarētais dibinātājs,Likvidēta,Adrese,Tālrunis,E-pasts
"""1 1 1 A neformālās izglītības iestāde""","3380802199","Juridiskā vai fiziskā persona ","MAREKS SPRŪŽS",0,0,"Pieaugušo neformālās izglītības iestāde","Pieaugušo neformālās izglītības iestāde","Sabiedrība ar ierobežotu atbildību ""Dialogs AB""","Sabiedrība ar ierobežotu atbildību ""Dialogs AB""",Nē,"MURJĀŅU IELA 1A, VIDZEMES PRIEKŠPILSĒTA, RĪGA, LV-1024","67432343, 29408456","info@dialogs-ab.lv"
"""1 1 A SOLLERTIA neformālās izglītības iestāde""","4380802201","Komercsabiedrības struktūrvienība","MAREKS SPRŪŽS",0,0,"Pieaugušo neformālās izglītības iestāde","Pieaugušo neformālās izglītības iestāde","""1 1 A SOLLERTIA"" SIA","""1 1 A SOLLERTIA"" SIA",Nē,"RIČU IELA 6, SIGUĻI, CARNIKAVAS NOVADS, LV-2163","29408456","info@sollertia.lv"
"""A.D.Streem"" mācību centrs","2760800906","Komercsabiedrības struktūrvienība","ALEKSANDRS DAVIDĀNS",0,0,"Profesionālās tālākizglītības un pilnveides izglītības iestāde","Profesionālās tālākizglītības un pilnveides izglītības iestāde","Sabiedrība ar ierobežotu atbildību ""A.D.Streem""","Sabiedrība ar ierobežotu atbildību ""A.D.Streem""",Nē,"18. NOVEMBRA IELA 104a, DAUGAVPILS, LV-5404","26297087","adstreem@inbox.lv"
"""HOTEL SCHOOL"" Viesnīcu biznesa koledža","3347802926","Komercsabiedrība",,0,0,"Augstākās izglītības iestāde","Koledža","Jūlija Pasnaka","Jūlija Pasnaka",Nē,"SMILŠU IELA 3, CENTRA RAJONS, RĪGA, LV-1050","67213037","info@hotelschool.lv"
"""IZGLĪTĪBAS CENTRS PROFEKTIS"" profesionālās pilnveides un tālākizglītības iestāde","3360802002","Komercsabiedrības struktūrvienība","AINĀRS STIKUTS",0,0,"Profesionālās tālākizglītības un pilnveides izglītības iestāde","Profesionālās tālākizglītības un pilnveides izglītības iestāde","""PROFEKTIS"" SIA","""PROFEKTIS"" SIA",Nē,"VIESTURA PROSPEKTS 33 k-1 - 57, ZIEMEĻU RAJONS, RĪGA, LV-1005","27707252,26544773","icprofektis@inbox.lv"
"""Klusuma skolas"" pieaugušo neformālās izglītības iestāde","4380802258","Biedrības struktūrvienība","IVO STRANTE",0,0,"Pieaugušo neformālās izglītības iestāde","Pieaugušo neformālās izglītības iestāde","""Klusuma skola""","""Klusuma skola""",Nē,"LAMBERTU IELA 34, MĀRUPE, MĀRUPES NOVADS, LV-2167","27111718","strante@gmail.com"
"""Komplekss Citadele"" SIA Profesionālo Studiju Skola ""Citadele""","3060800104","Komercsabiedrības struktūrvienība","JOLANTA ZĀLMANSONE",0,3,"Profesionālās tālākizglītības un pilnveides izglītības iestāde","Profesionālās tālākizglītības un pilnveides izglītības iestāde","""Komplekss Citadele"" SIA","""Komplekss Citadele"" SIA",Nē,"GRAUDU IELA 40 - 1, LIEPĀJA, LV-3401","27728855, 63428855, 67528855, 29528855","info@skolacitadele.lv"
"""Latvijas Pašvaldību mācību centrs""","3360800184","Biedrība","GUNITA RAKĒVIČA",0,0,"Profesionālās tālākizglītības un pilnveides izglītības iestāde","Profesionālās tālākizglītības un pilnveides izglītības iestāde","Rīgas Dome, Valmieras pilsētas pašvaldība, Jūrmalas pilsētas Dome, Liepājas pilsētas Dome, Ventspils pilsētas Dome, Latvijas Pašvaldību savienība, Alūksnes novada pašvaldība, Krustpils novada pašvaldība, Madonas novada pašvaldība, Ērgļu novada pašvaldība, Bauskas novada pašvaldība, Inčukalna novada Dome, Jaunpils novada Dome, Ogres novada Dome, Pāvilostas novada pašvaldība, Strenču novada Dome, Talsu novada Dome, Akciju sabiedrība ""Latvijas valsts meži""","Rīgas Dome, Jūrmalas pilsētas Dome, Liepājas pilsētas Dome, Ogres novada Dome, Ventspils pilsētas Dome, Valmieras pilsētas Dome, Latvijas Pašvaldību savienība, Pāvilostas novada Dome, Talsu novada Dome, Madonas novada Dome, Jaunpils novada Dome, Strenču novada Dome, Alūksnes novada pašvaldība, Krustpils novada pašvaldība, Madonas novada pašvaldība, Bauskas novada Dome, Ērgļu novada pašvaldība, Alūksnes novada Dome, Bauskas novada pašvaldība, Inčukalna novada Dome, Talsu novada Dome, Akciju sabiedrība ""Latvijas valsts meži""",Nē,"BIĶERNIEKU IELA 4, VIDZEMES PRIEKŠPILSĒTA, RĪGA, LV-1039","67551217 ","lpmc@lpmc.lv"
"""Liepājas Līvupes pamatskola - attīstības centrs""","3024903267","Pastarpinātās pārvaldes iestāde","SARMĪTE SIDOROVA",0,0,"Speciālās izglītības iestāde","Internātskola - attīstības centrs","Liepājas pilsētas Dome","Liepājas pilsētas Dome",Nē,"ULIHA IELA 56, LIEPĀJA, LV-3401","63422874","livupe@liepaja.edu.lv"
"""Mācību centrs Liepa""","3360800447","Komercsabiedrības struktūrvienība","JĀNIS DANCIS",0,0,"Profesionālās tālākizglītības un pilnveides izglītības iestāde","Profesionālās tālākizglītības un pilnveides izglītības iestāde","SIA ""Mācību centrs Liepa""","SIA ""Mācību centrs Liepa""",Nē,"BRASLAS IELA 24C, VIDZEMES PRIEKŠPILSĒTA, RĪGA, LV-1035","67552522","liepa@mcliepa.lv"
"""MĀCĪBU CENTRS"" SIA","2560800035","Komercsabiedrība",,0,0,"Profesionālās tālākizglītības un pilnveides izglītības iestāde","Profesionālās tālākizglītības un pilnveides izglītības iestāde","Anita Bedrīte","Anita Bedrīte",Nē,"CĒSU IELA 20, VALMIERA, LV-4201","64223559  29426161","anita.bedrite@inbox.lv"
"""Narmadas Tautskola""","4480802232","Biedrības struktūrvienība","ANDA PĒKŠĒNA",0,0,"Pieaugušo neformālās izglītības iestāde","Pieaugušo neformālās izglītības iestāde","Straupes pilsētas atdzimšanas biedrība","Straupes pilsētas atdzimšanas biedrība",Nē,"""Valdaines"", STRAUPES PAGASTS, PĀRGAUJAS NOVADS, LV-4152","26189503","info@narmadastautskola.lv"
"""PĀRSLA-APSARDZE"" mācību centrs","3360800760","Komercsabiedrības struktūrvienība",,0,0,"Profesionālās tālākizglītības un pilnveides izglītības iestāde","Profesionālās tālākizglītības un pilnveides izglītības iestāde","Sabiedrība ar ierobežotu atbildību ""PĀRSLA-APSARDZE""","Sabiedrība ar ierobežotu atbildību ""PĀRSLA-APSARDZE""",Nē,"MASKAVAS IELA 322d, LATGALES PRIEKŠPILSĒTA, RĪGA, LV-1063","67132571","apsardze@apollo.lv"
"""Ritma Institūts"" privātā mūzikas skola","3351802586","Komercsabiedrības struktūrvienība",,0,0,"Bērnu un jauniešu interešu izglītības iestāde","Bērnu un jauniešu interešu izglītības iestāde","Sabiedrība ar ierobežotu atbildību ""TERCS""","Sabiedrība ar ierobežotu atbildību ""TERCS""",Nē,"ĀRAIŠU IELA 34, RĪGA, LV-1039","26433491","info@ritmainstituts.lv"
"""SAFEWORK"" mācību centrs","3360800848","Komercsabiedrības struktūrvienība",,0,0,"Profesionālās tālākizglītības un pilnveides izglītības iestāde","Profesionālās tālākizglītības un pilnveides izglītības iestāde","SIA ""GRIF"" filiāle ""SAFEWORK.LV""","SIA ""GRIF"" filiāle ""SAFEWORK.LV""",Nē,"MASKAVAS IELA 361, LATGALES PRIEKŠPILSĒTA, RĪGA, LV-1063","67187661","das@grif.lv"
"0 1 A FORTŪNA SIA","3360800733","Komercsabiedrība","ALEKSANDRS VOROBJOVS",0,0,"Profesionālās tālākizglītības un pilnveides izglītības iestāde","Profesionālās tālākizglītības un pilnveides izglītības iestāde","Aleksandrs Vorobjovs","Aleksandrs Vorobjovs",Nē,"MERĶEĻA IELA 17/19 - 3, CENTRA RAJONS, RĪGA, LV-1050","29230037","vorobjovs@fortuna.lv"
"A/s ""Datorzinību centrs"" Mācību centrs","3360800438","Komercsabiedrības struktūrvienība",,0,0,"Profesionālās tālākizglītības un pilnveides izglītības iestāde","Profesionālās tālākizglītības un pilnveides izglītības iestāde","A/s ""Datorzinību centrs""","A/s ""Datorzinību centrs""",Nē,"LĀČPLĒŠA IELA 11, VIDZEMES PRIEKŠPILSĒTA, RĪGA, LV-1011","67338366","kursi@dzc.lv"
"A/s ""Mācību komercfirma""","3360800060","Komercsabiedrība",,0,0,"Profesionālās tālākizglītības un pilnveides izglītības iestāde","Profesionālās tālākizglītības un pilnveides izglītības iestāde","Sabiedrība ar ierobežotu atbildību ""GRANT-M""","Sabiedrība ar ierobežotu atbildību ""GRANT-M""",Nē,"VISVALŽA IELA 6, RĪGA, LV-1050","67288468","mkf@mkf.riga.lv"
"A/s ""Rīgas siltums"" Mācību centrs","3760800021","Komercsabiedrības struktūrvienība",,0,0,"Profesionālās tālākizglītības un pilnveides izglītības iestāde","Profesionālās tālākizglītības un pilnveides izglītības iestāde","A/s ""Rīgas siltums""","A/s ""Rīgas siltums""",Nē,"CĒSU IELA 3a, RĪGA, LV-1012","67017230","valdis.varavs@rs.lv"
"A/s ""Ventspils tirdzniecības osta"" Mācību centrs","3260800212","Komercsabiedrības struktūrvienība",,0,0,"Profesionālās tālākizglītības un pilnveides izglītības iestāde","Profesionālās tālākizglītības un pilnveides izglītības iestāde","A/s ""Ventspils tirdzniecības osta""","A/s ""Ventspils tirdzniecības osta""",Nē,"DZINTARU IELA 22, VENTSPILS, LV-3602","63668320","macibu.centrs@vcp.lv"
"Ābeļu pamatskola","4512900267","Pastarpinātās pārvaldes iestāde","JURIS GAIGALS",0,0,"Vispārējās izglītības iestāde","Vispārizglītojošā pamatskola","Jēkabpils novada pašvaldība","Jēkabpils novada pašvaldība",Nē,"""Ābeļu pamatskola"", ĀBEĻI, ĀBEĻU PAGASTS, JĒKABPILS NOVADS, LV-5212","65236656, 26422133, 65236835","abelupsk@jekabpilsnovads.lv"
"Ādažu Bērnu un jaunatnes sporta skola","4371902180","Pastarpinātās pārvaldes iestāde","DAGNIJA ZILBERTE",0,0,"Profesionālās ievirzes izglītības iestāde","Sporta skola","Ādažu novada Dome","Ādažu novada Dome",Nē,"GAUJAS IELA 30, ĀDAŽI, ĀDAŽU NOVADS, LV-2164","27746508","sporta.skola@adazi.lv"
"Ādažu Mākslas un mūzikas skola","4374902096","Pastarpinātās pārvaldes iestāde","KRISTĪNE SAVICKA",0,0,"Profesionālās ievirzes izglītības iestāde","Mūzikas un mākslas skola","Ādažu novada Dome","Ādažu novada Dome",Nē,"GAUJAS IELA 33a, ĀDAŽI, ĀDAŽU NOVADS, LV-2164","67997780","makslu.skola@adazi.lv"
"Ādažu pirmsskolas izglītības iestāde ""Strautiņš""","4301901917","Pastarpinātās pārvaldes iestāde","SANDRA BREIDAKA",0,0,"Pirmsskolas izglītības iestāde","Pirmsskolas izglītības iestāde","Ādažu novada Dome","Ādažu novada Dome",Nē,"PIRMĀ IELA 26a, ĀDAŽI, ĀDAŽU NOVADS, LV-2164","67997458",
"Ādažu vidusskola","4313901280","Pastarpinātās pārvaldes iestāde",,0,0,"Vispārējās izglītības iestāde","Vispārizglītojošā vidusskola","Ādažu novada Dome","Ādažu novada Dome",Nē,"GAUJAS IELA 30, ĀDAŽI, ĀDAŽU NOVADS, LV-2164","67996165","vidusskola@adazi.tl.lv"
"Āgenskalna sākumskola","3511900641","Pastarpinātās pārvaldes iestāde","INĀRA KAĶĪTE",0,0,"Vispārējās izglītības iestāde","Vispārizglītojošā sākumskola","Rīgas Dome","Rīgas Dome",Nē,"KANDAVAS IELA 4 k-1, KURZEMES RAJONS, RĪGA, LV-1083","67474177","aksk@riga.lv"
"Āgenskalna Valsts ģimnāzija","3819900703","Pastarpinātās pārvaldes iestāde","INĀRA GAILE",0,1,"Vispārējās izglītības iestāde","Valsts ģimnāzija","Rīgas Dome","Rīgas Dome",Nē,"LAVĪZES IELA 2a, ZEMGALES PRIEKŠPILSĒTA, RĪGA, LV-1002","67611185, 67614133","avg@riga.lv"
"Aglonas bazilikas Kora skola","4276902470","Pastarpinātās pārvaldes iestāde","JUTA KONDAVNIECE",0,0,"Profesionālās ievirzes izglītības iestāde","Mūzikas skola","Aglonas bazilikas draudze, Aglonas novada dome","Aglonas bazilikas draudze, Aglonas novada Dome",Nē,"CIRIŠA IELA 8, AGLONA, AGLONAS PAGASTS, AGLONAS NOVADS, LV-5304","25911398","aks@aglonasbazilika.lv"
"Aglonas bērnu un jauniešu brīvā laika pavadīšanas centrs ""Strops""","4251903235","Pastarpinātās pārvaldes iestāde","MĀRA UŠACKA",0,0,"Bērnu un jauniešu interešu izglītības iestāde","Bērnu un jauniešu interešu izglītības iestāde","Aglonas novada dome","Aglonas novada dome",Nē,"DAUGAVPILS IELA 8, AGLONA, AGLONAS PAGASTS, AGLONAS NOVADS, LV-5304","29947906","mara.usacka@glona.lv"
"Aglonas Katoļu ģimnāzija","4213800388","Juridiskā vai fiziskā persona ","ANITA PLACINSKA",0,0,"Vispārējās izglītības iestāde","Vispārizglītojošā vidusskola","AGLONAS BAZILIKAS DRAUDZE","AGLONAS BAZILIKAS DRAUDZE",Nē,"ALOĪZA BROKA IELA 8, AGLONA, AGLONAS PAGASTS, AGLONAS NOVADS, LV-5304","29377165","aglonaskatgim@pvg.edu.lv"
"Aglonas novada pirmsskolas izglītības iestāde","4201900395","Pastarpinātās pārvaldes iestāde","VALENTĪNA MIHAILOVA",0,0,"Pirmsskolas izglītības iestāde","Pirmsskolas izglītības iestāde","Aglonas novada dome","Aglonas novada Dome",Nē,"JAUDZEMU IELA 7a, AGLONA, AGLONAS PAGASTS, AGLONAS NOVADS, LV-5304","65322451","bernudarzs@aglona.lv"
"Aglonas vidusskola","4213900381","Pastarpinātās pārvaldes iestāde","LIDIJA ŠATILOVA",0,0,"Vispārējās izglītības iestāde","Vispārizglītojošā vidusskola","Aglonas novada dome","Aglonas novada Dome",Nē,"DAUGAVPILS IELA 6, AGLONA, AGLONAS PAGASTS, AGLONAS NOVADS, LV-5304","65321373","aglonasvsk@pvg.edu.lv"
"Agra Daņiļeviča deju skola","3372802659","Komercsabiedrības struktūrvienība","SINGITA DAŅIĻEVIČA",0,0,"Profesionālās ievirzes izglītības iestāde","Deju skola","Sabiedrība ar ierobežotu atbildību ""Dance""","Sabiedrība ar ierobežotu atbildību ""Dance""",Nē,"LĀČPLĒŠA IELA 106 k-1, LATGALES PRIEKŠPILSĒTA, RĪGA, LV-1003","29410450","info@dzirnas.lv"
"Aizkraukles Interešu izglītības centrs","4551902023","Pastarpinātās pārvaldes iestāde","ZANE ROMANOVA",0,0,"Bērnu un jauniešu interešu izglītības iestāde","Bērnu un jauniešu interešu izglītības iestāde","Aizkraukles novada pašvaldība","Aizkraukles pilsētas Dome",Nē,"SPĪDOLAS IELA 11, AIZKRAUKLE, AIZKRAUKLES NOVADS, LV-5101","65122862,65128534","aiic@aizkraukle.lv"
"Aizkraukles Mākslas skola","4575902101","Pastarpinātās pārvaldes iestāde","INESE DEMBOVSKA",0,0,"Profesionālās ievirzes izglītības iestāde","Mākslas skola","Aizkraukles novada pašvaldība","Aizkraukles novada dome",Nē,"SPĪDOLAS IELA 1, AIZKRAUKLE, AIZKRAUKLES NOVADS, LV-5101","65123160","aizms@inbox.lv"
"Aizkraukles novada Sporta skola","4571902205","Pastarpinātās pārvaldes iestāde","BRIGITA KRAUZE",0,0,"Profesionālās ievirzes izglītības iestāde","Sporta skola","Aizkraukles novada pašvaldība","Aizkraukles novada pašvaldība",Nē,"DRAUDZĪBAS KRASTMALA 6, AIZKRAUKLE, AIZKRAUKLES NOVADS, LV-5101","65122773","sportask@inbox.lv"
"Aizkraukles novada vidusskola","4513903124","Pastarpinātās pārvaldes iestāde","ALDIS LABINSKIS",0,0,"Vispārējās izglītības iestāde","Vispārizglītojošā vidusskola","Aizkraukles novada pašvaldība","Aizkraukles novada pašvaldība",Nē,"LĀČPLĒŠA IELA 21, AIZKRAUKLE, AIZKRAUKLES NOVADS, LV-5101","28382330, 65122369, 65123228","vidusskola@aizkraukle.lv"
"Aizkraukles pagasta sākumskola","4511900989","Pastarpinātās pārvaldes iestāde","JANĪNA ZOLOTORENKO",0,0,"Vispārējās izglītības iestāde","Vispārizglītojošā sākumskola","Aizkraukles novada pašvaldība","Aizkraukles novada pašvaldība",Nē,"KALNA IELA 6, AIZKRAUKLE, AIZKRAUKLES PAGASTS, AIZKRAUKLES NOVADS, LV-5101","65128285, 26113790","aps@aizkraukle.lv"
"Aizkraukles pilsētas pirmsskolas izglītības iestāde ""Auseklītis""","4501901768","Pastarpinātās pārvaldes iestāde","INTA VĪBERGA",0,0,"Pirmsskolas izglītības iestāde","Pirmsskolas izglītības iestāde","Aizkraukles novada pašvaldība","Aizkraukles novada pašvaldība",Nē,"SPRĪDĪŠA IELA 3, AIZKRAUKLE, AIZKRAUKLES NOVADS, LV-5101","65121105","auseklitis@aizkraukle.lv"
"Aizkraukles pilsētas pirmsskolas izglītības iestāde ""Saulīte""","4501903388","Pastarpinātās pārvaldes iestāde","SARMĪTE KRUGLOVA",0,0,"Pirmsskolas izglītības iestāde","Pirmsskolas izglītības iestāde","Aizkraukles novada pašvaldība","Aizkraukles novada pašvaldība",Nē,"ZIEMEĻU IELA 1, AIZKRAUKLE, AIZKRAUKLES NOVADS, LV-5101","65123955, 29298620","saulite@aizkraukle.lv"
"Aizkraukles pilsētas pirmsskolas izglītības iestāde ""Zīlīte""","4501901773","Pastarpinātās pārvaldes iestāde","LIGITA NEIJA",0,0,"Pirmsskolas izglītības iestāde","Pirmsskolas izglītības iestāde","Aizkraukles novada pašvaldība","Aizkraukles novada dome",Nē,"BĒRZU IELA 10, AIZKRAUKLE, AIZKRAUKLES NOVADS, LV-5101","65122610","zilite@aizkraukle.lv"
"Aizkraukles Profesionālā vidusskola","4531002881","Valsts tiešās pārvaldes iestāde","RUTA KRŪKLE",0,1,"Profesionālās pamata un vidējās izglītības iestāde","Profesionālās vidējās izglītības iestāde","Izglītības un zinātnes ministrija","Latvijas Republikas Ministru kabinets",Nē,"JAUNCELTNES IELA 21, AIZKRAUKLE, AIZKRAUKLES NOVADS, LV-5101","65121035","aizkavs@inbox.lv"
"Aizputes Mākslas skola","4175902176","Pastarpinātās pārvaldes iestāde","ARMANDS AUSMANIS",0,0,"Profesionālās ievirzes izglītības iestāde","Mākslas skola","Aizputes novada Dome","Aizputes novada Dome",Nē,"ATMODAS IELA 19, AIZPUTE, AIZPUTES NOVADS, LV-3456","63448462","a.ams@inbox.lv"
"Aizputes Mūzikas skola","4176902157","Pastarpinātās pārvaldes iestāde","ARTA KANGIZERE",0,0,"Profesionālās ievirzes izglītības iestāde","Mūzikas skola","Aizputes novada Dome","Aizputes novada Dome",Nē,"JĀŅA IELA 12, AIZPUTE, AIZPUTES NOVADS, LV-3456","63448157","muzikasskola@aizpute.lv"
"Aizputes novada Skolēnu jaunrades centrs","4151902031","Pastarpinātās pārvaldes iestāde","AUSMA KIRHNERE",0,0,"Bērnu un jauniešu interešu izglītības iestāde","Bērnu un jauniešu interešu izglītības iestāde","Aizputes novada Dome","Aizputes novada Dome",Nē,"SKOLAS IELA 1, AIZPUTE, AIZPUTES NOVADS, LV-3456","26372370","sjca@inbox.lv"
"Aizputes novada vidusskola","4113903289","Pastarpinātās pārvaldes iestāde","TAISA SOROKINA",0,0,"Vispārējās izglītības iestāde","Vispārizglītojošā vidusskola","Aizputes novada Dome","Aizputes novada Dome",Nē,"ZIEDU IELA 7, AIZPUTE, AIZPUTES NOVADS, LV-3456","26327677","neklatiene@aizpute.lv"
"Aizputes pagasta pamatskola","4112901031","Pastarpinātās pārvaldes iestāde","RENĀTE GOLDBERGA",0,0,"Vispārējās izglītības iestāde","Vispārizglītojošā pamatskola","Aizputes novada Dome","Aizputes novada Dome",Nē,"""Skola"", ROKASBIRZE, AIZPUTES PAGASTS, AIZPUTES NOVADS, LV-3456","20371571","pamatskola@aizpute.lv"
"Aizputes pirmsskolas izglītības iestāde ""Pasaciņa""","4101901761","Pastarpinātās pārvaldes iestāde","ANTRA APINE",0,0,"Pirmsskolas izglītības iestāde","Pirmsskolas izglītības iestāde","Aizputes novada Dome","Aizputes novada Dome",Nē,"ZVAIGŽŅU IELA 6, AIZPUTE, AIZPUTES NOVADS, LV-3456","63449087","aizpute.pasacina@inbox.lv"
"Aizputes vidusskola","4113901044","Pastarpinātās pārvaldes iestāde","GUNTA VĪDNERE",0,0,"Vispārējās izglītības iestāde","Vispārizglītojošā vidusskola","Aizputes novada Dome","Aizputes novada Dome",Nē,"ZIEDU IELA 7, AIZPUTE, AIZPUTES NOVADS, LV-3456","63448251","vidusskola@aizpute.lv"
"Aizupes pamatskola","4512900847","Pastarpinātās pārvaldes iestāde","ZANE LANGE",0,0,"Vispārējās izglītības iestāde","Vispārizglītojošā pamatskola","Jelgavas novada pašvaldība","Jelgavas novada pašvaldība",Nē,"""Aizupes skola"", TUŠĶI, LĪVBĒRZES PAGASTS, JELGAVAS NOVADS, LV-3003","63083046","aizupespsk@jelgavasnovads.lv"
"Aknīstes Bērnu un jauniešu centrs","4551901262","Pastarpinātās pārvaldes iestāde","EVIJA ĶIĶĒNA",0,0,"Bērnu un jauniešu interešu izglītības iestāde","Bērnu un jauniešu interešu izglītības iestāde","Aknīstes novada pašvaldība","Aknīstes novada pašvaldība",Nē,"SKOLAS IELA 1A, AKNĪSTE, AKNĪSTES NOVADS, LV-5208","65266339, 28349251","akn.bjc.evija@inbox.lv"
"Aknīstes novada pašvaldības pirmsskolas izglītības iestāde ""Bitīte""","4501900305","Pastarpinātās pārvaldes iestāde","RIMA BLUDZE",0,0,"Pirmsskolas izglītības iestāde","Pirmsskolas izglītības iestāde","Aknīstes novada pašvaldība","Aknīstes novada pašvaldība",Nē,"SKOLAS IELA 16A, AKNĪSTE, AKNĪSTES NOVADS, LV-5208","65236603","pii_bitite@inbox.lv"
"Aknīstes vidusskola","4513900255","Pastarpinātās pārvaldes iestāde","AIJA VOITIŠKE",0,0,"Vispārējās izglītības iestāde","Vispārizglītojošā vidusskola","Aknīstes novada pašvaldība","Aknīstes novada pašvaldība",Nē,"SKOLAS IELA 19, AKNĪSTE, AKNĪSTES NOVADS, LV-5208","65266221","aknistevs@gmail.com"
"Aleksandra Bieziņa Raiskuma pamatskola","4422903321","Pastarpinātās pārvaldes iestāde","LOLITA ŽAGARE",0,0,"Speciālās izglītības iestāde","Speciālā pamatskola","Pārgaujas novada pašvaldība","Pārgaujas novada pašvaldība",Nē,"""Dzelmes 5"", RAISKUMS, RAISKUMA PAGASTS, PĀRGAUJAS NOVADS, LV-4146","64107934","kanc@raiskint.apollo.lv"
"Aleksandrovas pamatskola","4222900579","Pastarpinātās pārvaldes iestāde","ANITA MALINOVSKA",0,0,"Speciālās izglītības iestāde","Speciālā pamatskola","Dagdas novada pašvaldība","Dagdas novada pašvaldība",Nē,"""Aleksandrovas skola"", ALEKSANDROVA, KONSTANTINOVAS PAGASTS, DAGDAS NOVADS, LV-5680","65621023","aleksandrova-skola@inbox.lv"
"Alekseja Grāvīša Liepnas pamatskola","4412903320","Pastarpinātās pārvaldes iestāde","ILONA KAZIMIRJONOKA",0,0,"Vispārējās izglītības iestāde","Vispārizglītojošā pamatskola","Alūksnes novada pašvaldība","Alūksnes novada pašvaldība",Nē,"""Liepnas pamatskola"", LIEPNA, LIEPNAS PAGASTS, ALŪKSNES NOVADS, LV-4354","26131191","lvs@aluksne.lv"
"Alfrēda Kalniņa Cēsu Mūzikas vidusskola","4431301248","Valsts tiešās pārvaldes iestāde","VIGO RAČEVSKIS",0,0,"Profesionālās pamata un vidējās izglītības iestāde","Profesionālās vidējās izglītības iestāde","Kultūras ministrija","Latvijas Republikas Ministru kabinets",Nē,"RAUNAS IELA 12 - 2, CĒSIS, CĒSU NOVADS, LV-4101","64125385","akcmv@akcmv.gov.lv"
"Alises Rozes mācību centrs","4480800634","Komercsabiedrības struktūrvienība","PĒTERIS ZĀLĪTIS",0,0,"Pieaugušo neformālās izglītības iestāde","Pieaugušo neformālās izglītības iestāde","Sabiedrība ar ierobežotu atbildību ""VMVK""","Sabiedrība ar ierobežotu atbildību ""VMVK""",Nē,"CĒSU IELA 8, RAUNA, RAUNAS PAGASTS, RAUNAS NOVADS, LV-4131","29407834, 27016634","maksla@arstudio.lv"
"Allažu pamatskola","4312901109","Pastarpinātās pārvaldes iestāde","AINA KEPLERE",0,0,"Vispārējās izglītības iestāde","Vispārizglītojošā pamatskola","Siguldas novada pašvaldība","Siguldas novada pašvaldība",Nē,"SKOLAS IELA 5, ALLAŽI, ALLAŽU PAGASTS, SIGULDAS NOVADS, LV-2154","67970954, 67970949","allazu.pamatskola@sigulda.lv"
"Alojas Ausekļa vidusskola","4313900157","Pastarpinātās pārvaldes iestāde","INA ŠTERNFELDE",0,0,"Vispārējās izglītības iestāde","Vispārizglītojošā vidusskola","Alojas novada dome","Alojas novada Dome",Nē,"AUSEKĻA IELA 1, ALOJA, ALOJAS NOVADS, LV-4064","64031201","alojas.vsk@aloja.lv"
"Alojas Mūzikas un mākslas skola","4374902295","Pastarpinātās pārvaldes iestāde","LAILA ULMANE",0,0,"Profesionālās ievirzes izglītības iestāde","Mūzikas un mākslas skola","Alojas novada dome","Alojas novada Dome",Nē,"JŪRAS IELA 39A, ALOJA, ALOJAS NOVADS, LV-4064","64031468, 64031235","alojamms@inbox.lv"
"Alojas novada sporta skola","4371902426","Pastarpinātās pārvaldes iestāde","RŪTA EZERNIECE",0,0,"Profesionālās ievirzes izglītības iestāde","Sporta skola","Alojas novada dome","Alojas novada Dome",Nē,"LIELĀ IELA 7, STAICELE, ALOJAS NOVADS, LV-4043","64023031","sporta.skola@aloja.lv"
"Alojas pilsētas pirmsskolas izglītības iestāde ""Auseklītis""","4301900542","Pastarpinātās pārvaldes iestāde","SARMĪTE FREIMANE",0,1,"Pirmsskolas izglītības iestāde","Pirmsskolas izglītības iestāde","Alojas novada dome","Alojas novada Dome",Nē,"PARKA IELA 13, ALOJA, ALOJAS NOVADS, LV-4064","64031258, 26386729","auseklitis@aloja.lv"
"Alsungas Mūzikas skola","4176902156","Pastarpinātās pārvaldes iestāde","JANETA VAŠKUS",0,0,"Profesionālās ievirzes izglītības iestāde","Mūzikas skola","Alsungas novada Dome","Alsungas novada Dome",Nē,"SKOLAS IELA 11, ALSUNGA, ALSUNGAS NOVADS, LV-3306","63351450","alsungasmuzikaskola@apollo.lv"
"Alsungas pirmsskolas izglītības iestāde ""Miķelītis""","4101901410","Pastarpinātās pārvaldes iestāde","ALETA LIPSNE",0,0,"Pirmsskolas izglītības iestāde","Pirmsskolas izglītības iestāde","Alsungas novada Dome","Alsungas novada Dome",Nē,"SKOLAS IELA 16a, ALSUNGA, ALSUNGAS NOVADS, LV-3306","63351382","alsungasbn@inbox.lv"
"Alsungas vidusskola","4113901196","Pastarpinātās pārvaldes iestāde","UNDĪNE PRIEDOLIŅA",0,0,"Vispārējās izglītības iestāde","Vispārizglītojošā vidusskola","Alsungas novada Dome","Alsungas novada Dome",Nē,"SKOLAS IELA 11, ALSUNGA, ALSUNGAS NOVADS, LV-3306","63351127","vidusskola@alsunga.lv"
"Alsviķu pirmsskolas izglītības iestāde ""Saulīte""","4401901484","Pastarpinātās pārvaldes iestāde","VIOLA LĀCE",0,0,"Pirmsskolas izglītības iestāde","Pirmsskolas izglītības iestāde","Alūksnes novada pašvaldība","Alūksnes novada pašvaldība",Nē,"Saulīte, ALSVIĶI, ALSVIĶU PAGASTS, ALŪKSNES NOVADS, LV-4333","29162206","saulite@aluksne.lv"
"Alūksnes Bērnu un jauniešu centrs","4451902238","Pastarpinātās pārvaldes iestāde","EVA AIZUPE",0,0,"Bērnu un jauniešu interešu izglītības iestāde","Bērnu un jauniešu interešu izglītības iestāde","Alūksnes novada pašvaldība","Alūksnes novada pašvaldība",Nē,"DĀRZA IELA 8a, ALŪKSNE, ALŪKSNES NOVADS, LV-4301","64322402, 29190552","abjc@aluksne.lv"
"Alūksnes Mākslas skola","4475902237","Pastarpinātās pārvaldes iestāde","OJĀRS VĒLIŅŠ",0,0,"Profesionālās ievirzes izglītības iestāde","Mākslas skola","Alūksnes novada pašvaldība","Alūksnes novada pašvaldība",Nē,"OJĀRA VĀCIEŠA IELA 2, ALŪKSNE, ALŪKSNES NOVADS, LV-4301","64322433, 29298964","makslasskola@aluksne.lv"
