Nosaukums,Reģistrācijas numurs,Juridiskais status,Vadītājs,Filiāļu skaits,Strukturvienību skaits,Veids,Tips,Faktiskais dibinātājs,Deklarētais dibinātājs,Likvidēta,Adrese,Tālrunis,E-pasts
"Komunikāciju izglītības aģentūra ""Puzzle""","4360800631","Komercsabiedrības struktūrvienība",,0,0,"Profesionālās tālākizglītības un pilnveides izglītības iestāde","Profesionālās tālākizglītības un pilnveides izglītības iestāde","Sabiedrība ar ierobežotu atbildību ""KOMUNIKĀCIJU AĢENTŪRA ""PUZZLE""""","Sabiedrība ar ierobežotu atbildību ""KOMUNIKĀCIJU AĢENTŪRA ""PUZZLE""""",Nē,"KRASTA IELA 7, OGRE, OGRES NOVADS, LV-5001","26165308","seminari@puzzle.lv"
"KOSMOZOFIJAS izglītības centrs ""SASKARSME""","3360800265","Komercsabiedrības struktūrvienība",,0,0,"Profesionālās tālākizglītības un pilnveides izglītības iestāde","Profesionālās tālākizglītības un pilnveides izglītības iestāde","SIA KOSMOZOFIJAS institūts ""SASKARSME""","SIA KOSMOZOFIJAS institūts ""SASKARSME""",Nē,"MATĪSA IELA 49, LATGALES PRIEKŠPILSĒTA, RĪGA, LV-1011","29458969","saskarsme.inst@inbox.lv"
"Krāslavas Bērnu un jauniešu centrs","4251900581","Pastarpinātās pārvaldes iestāde","ELFA BIŽĀNE",0,0,"Bērnu un jauniešu interešu izglītības iestāde","Bērnu un jauniešu interešu izglītības iestāde","Krāslavas novada Dome","Krāslavas novada Dome",Nē,"RAIŅA IELA 25, KRĀSLAVA, KRĀSLAVAS NOVADS, LV-5601","29661865","elfa.islamgarajeva@kraslava.lv"
"Krāslavas gr. Plāteru v.n. Poļu pamatskola","4212900569","Pastarpinātās pārvaldes iestāde","ČESLAVA KOZLOVSKA",0,0,"Vispārējās izglītības iestāde","Vispārizglītojošā pamatskola","Krāslavas novada Dome","Krāslavas novada Dome",Nē,"RĒZEKNES IELA 39, KRĀSLAVA, KRĀSLAVAS NOVADS, LV-5601","65622771 65622756 65622749","polupamatskola@kraslava.lv"
"Krāslavas Mākslas skola","4275902367","Pastarpinātās pārvaldes iestāde","VALDIS PAULIŅŠ",0,0,"Profesionālās ievirzes izglītības iestāde","Mākslas skola","Krāslavas novada Dome","Krāslavas novada Dome",Nē,"RAIŅA IELA 6, KRĀSLAVA, KRĀSLAVAS NOVADS, LV-5601","65681164","kmakslasskola@inbox.lv"
"Krāslavas Mūzikas skola","4276902298","Pastarpinātās pārvaldes iestāde","OLGA GRECKA",0,0,"Profesionālās ievirzes izglītības iestāde","Mūzikas skola","Krāslavas novada Dome","Krāslavas novada Dome",Nē,"RĒZEKNES IELA 4, KRĀSLAVA, KRĀSLAVAS NOVADS, LV-5601","65622408","kraslavas.muz.sk@inbox.lv"
"Krāslavas novada pirmsskolas izglītības iestāde ""Pīlādzītis""","4201900582","Pastarpinātās pārvaldes iestāde","SVETLANA RUKMANE",0,0,"Pirmsskolas izglītības iestāde","Pirmsskolas izglītības iestāde","Krāslavas novada Dome","Krāslavas novada Dome",Nē,"ARONSONA IELA 1, KRĀSLAVA, KRĀSLAVAS NOVADS, LV-5601","65622249","piladzitis@kraslava.lv"
"Krāslavas pirmsskolas izglītības iestāde ""Pienenīte""","4201900584","Pastarpinātās pārvaldes iestāde","VIKTORIJA OLEHNO",0,0,"Pirmsskolas izglītības iestāde","Pirmsskolas izglītības iestāde","Krāslavas novada Dome","Krāslavas novada Dome",Nē,"EZERA IELA 15, KRĀSLAVA, KRĀSLAVAS NOVADS, LV-5601","65622582, 65622692","olehvik@inbox.lv"
"Krāslavas Sporta skola","4271902119","Pastarpinātās pārvaldes iestāde","ARTIS UPENIEKS",0,0,"Profesionālās ievirzes izglītības iestāde","Sporta skola","Krāslavas novada Dome","Krāslavas novada Dome",Nē,"PILS IELA 5, KRĀSLAVA, KRĀSLAVAS NOVADS, LV-5601","65622722 65622724","sportaskola@kraslava.lv"
"Krāslavas Valsts ģimnāzija","4219902694","Pastarpinātās pārvaldes iestāde","JĀNIS TUKĀNS",0,0,"Vispārējās izglītības iestāde","Valsts ģimnāzija","Krāslavas novada Dome","Krāslavas novada Dome",Nē,"PILS IELA 5, KRĀSLAVA, KRĀSLAVAS NOVADS, LV-5601","65622095, 65622096","kvg@kraslava.lv"
"Krāslavas Varavīksnes vidusskola","4213900576","Pastarpinātās pārvaldes iestāde","MARIJA MICĶEVIČA",0,0,"Vispārējās izglītības iestāde","Vispārizglītojošā vidusskola","Krāslavas novada Dome","Krāslavas novada Dome",Nē,"N. RANCĀNA IELA 4, KRĀSLAVA, KRĀSLAVAS NOVADS, LV-5601","65681468","varaviksne@kraslava.lv"
"Krimuldas Mūzikas un mākslas skola","4374902310","Pastarpinātās pārvaldes iestāde","AIVARS BUNĶIS",0,0,"Profesionālās ievirzes izglītības iestāde","Mūzikas un mākslas skola","Krimuldas novada pašvaldība","Krimuldas novada Dome",Nē,"SKOLAS IELA 11, RAGANA, KRIMULDAS PAGASTS, KRIMULDAS NOVADS, LV-2144","26199526","krimulda.mms@inbox.lv"
"Krimuldas vidusskola","4313901119","Pastarpinātās pārvaldes iestāde","RITA ERDMANE",0,0,"Vispārējās izglītības iestāde","Vispārizglītojošā vidusskola","Krimuldas novada pašvaldība","Krimuldas novada Dome",Nē,"SKOLAS IELA 11, RAGANA, KRIMULDAS PAGASTS, KRIMULDAS NOVADS, LV-2144","67978525","krimulda.skola@latnet.lv"
"Kristiāna Dāvida pamatskola","4412802815","Biedrības struktūrvienība","AELITA KAULAČA",0,0,"Vispārējās izglītības iestāde","Vispārizglītojošā pamatskola","Biedrība ""Brāļu draudze""","Biedrība ""Brāļu draudze""",Nē,"""Kalna Skola"", BARKAVAS PAGASTS, MADONAS NOVADS, LV-4834","26557988","ch.davidschool@gmail.com"
"Kristīgā pirmsskola ""Matejs""","3601802027","Nodibinājuma struktūrvienība","IVETA RUDOVIČA",0,0,"Pirmsskolas izglītības iestāde","Pirmsskolas izglītības iestāde","Nodibinājums ""KRISTĪGI IZGLĪTOJOŠS BĒRNU UN JAUNATNES CENTRS ""MATEJS""","Nodibinājums ""KRISTĪGI IZGLĪTOJOŠS BĒRNU UN JAUNATNES CENTRS ""MATEJS""",Nē,"MATĪSA IELA 50B, LATGALES PRIEKŠPILSĒTA, RĪGA, LV-1009","67506028","centrs.matejs@matejs.lv"
"Kristīgā sākumskola ""Ceļš""","3711803265","Biedrības struktūrvienība","GUNA RĪMANE",0,0,"Vispārējās izglītības iestāde","Vispārizglītojošā sākumskola","Ceļabiedri","Ceļabiedri",Nē,"BRĪVĪBAS GATVE 229 - 5, VIDZEMES PRIEKŠPILSĒTA, RĪGA, LV-1039","26535522","info@ksc.lv"
"Kristīgās bērnu un jauniešu interešu izglītības iestāde - centrs ""Matejs""","3351802509","Nodibinājums",,0,0,"Bērnu un jauniešu interešu izglītības iestāde","Bērnu un jauniešu interešu izglītības iestāde","Nodibinājums ""KRISTĪGI IZGLĪTOJOŠS BĒRNU UN JAUNATNES CENTRS ""MATEJS""","Nodibinājums ""KRISTĪGI IZGLĪTOJOŠS BĒRNU UN JAUNATNES CENTRS ""MATEJS""",Nē,"MATĪSA IELA 50B, LATGALES PRIEKŠPILSĒTA, RĪGA, LV-1009","67506028, 29374427",
"Krišjāņa Kundziņa Cīņas sporta skola","3371902120","Pastarpinātās pārvaldes iestāde","GATIS RATNIEKS",0,0,"Profesionālās ievirzes izglītības iestāde","Sporta skola","Rīgas Dome","Rīgas Dome",Nē,"HIPOKRĀTA IELA 27, VIDZEMES PRIEKŠPILSĒTA, RĪGA, LV-1079","67536530","bjsskundzina@riga.lv"
"Krišjāņa Valdemāra Ainažu pamatskola","4312900160","Pastarpinātās pārvaldes iestāde","IEVA SKUJA",0,0,"Vispārējās izglītības iestāde","Vispārizglītojošā pamatskola","Salacgrīvas novada Dome","Salacgrīvas novada Dome",Nē,"PARKA IELA 12, AINAŽI, SALACGRĪVAS NOVADS, LV-4035","64043289","ainazu.skola@salacgriva.lv"
"Krotes Kronvalda Ata pamatskola","4112901033","Pastarpinātās pārvaldes iestāde","GITA SPIĢERE",0,0,"Vispārējās izglītības iestāde","Vispārizglītojošā pamatskola","Priekules novada pašvaldība","Priekules novada pašvaldība",Nē,"""Krotes pamatskola"", KROTE, BUNKAS PAGASTS, PRIEKULES NOVADS, LV-3444","63453070, 26183364","krotesskola@priekulesnovads.lv"
"Krustpils pamatskola","1012900275","Pastarpinātās pārvaldes iestāde","VIJA STIEBRIŅA",0,0,"Vispārējās izglītības iestāde","Vispārizglītojošā pamatskola","Krustpils novada pašvaldība","Krustpils novada pašvaldība",Nē,"MADONAS IELA 48, JĒKABPILS, LV-5202","65221063, 29503096","kps48@inbox.lv"
"Kubulu pirmsskolas izglītības iestāde ""Ieviņa""","4201902019","Pastarpinātās pārvaldes iestāde","INGA EISAKA",0,0,"Pirmsskolas izglītības iestāde","Pirmsskolas izglītības iestāde","Balvu novada pašvaldība","Balvu novada pašvaldība",Nē,"BALVU IELA 6, KUBULI, KUBULU PAGASTS, BALVU NOVADS, LV-4566","26617493","kubulipii@balvi.lv"
"Kuldīgas 2. vidusskola","4113901191","Pastarpinātās pārvaldes iestāde","GUNTRA BUIVIDA",0,0,"Vispārējās izglītības iestāde","Vispārizglītojošā vidusskola","Kuldīgas novada Dome","Kuldīgas novada Dome",Nē,"JELGAVAS IELA 62, KULDĪGA, KULDĪGAS NOVADS, LV-3301","20269435, 27020639","kuldiga2vsk@kuldiga.lv"
"Kuldīgas Centra vidusskola","4113901192","Pastarpinātās pārvaldes iestāde","BRIGITA FREIJA",0,0,"Vispārējās izglītības iestāde","Vispārizglītojošā vidusskola","Kuldīgas novada Dome","Kuldīgas novada Dome",Nē,"MUCENIEKU IELA 6, KULDĪGA, KULDĪGAS NOVADS, LV-3301","63323978","kcv@inbox.lv"
"Kuldīgas Kristīgā pamatskola","4112803383","Biedrības struktūrvienība","LĀSMA VĪTOLIŅA",0,0,"Vispārējās izglītības iestāde","Vispārizglītojošā pamatskola","""KULDĪGAS MANTOJUMS""","""KULDĪGAS MANTOJUMS""",Nē,"KAĻĶU IELA 33, KULDĪGA, KULDĪGAS NOVADS, LV-3301","29555057","kuldigasmantojums@gmail.com"
"Kuldīgas Mākslas un humanitāro zinību vidusskola","4113901189","Pastarpinātās pārvaldes iestāde","VALDA GAURE",0,0,"Vispārējās izglītības iestāde","Vispārizglītojošā vidusskola","Kuldīgas novada Dome","Kuldīgas novada Dome",Nē,"PĒTERA IELA 5, KULDĪGA, KULDĪGAS NOVADS, LV-3301","63322520","kmhzv@kuldiga.lv"
"Kuldīgas novada Bērnu un jauniešu centrs","4151902678","Pastarpinātās pārvaldes iestāde","INESE ASTAŠEVSKA",0,0,"Bērnu un jauniešu interešu izglītības iestāde","Bērnu un jauniešu interešu izglītības iestāde","Kuldīgas novada Dome","Kuldīgas novada Dome",Nē,"1905. GADA IELA 10, KULDĪGA, KULDĪGAS NOVADS, LV-3301","20269433","jauniesucentrs@kuldiga.lv"
"Kuldīgas novada pašvaldības pirmsskolas izglītības iestāde ""Bitīte""","4101903272","Pastarpinātās pārvaldes iestāde","LĪGA MEGNE",0,0,"Pirmsskolas izglītības iestāde","Pirmsskolas izglītības iestāde","Kuldīgas novada Dome","Kuldīgas novada Dome",Nē,"PARKA IELA 22, KULDĪGA, KULDĪGAS NOVADS, LV-3301","63320467","bd.bitite@kuldiga.lv"
"Kuldīgas novada Sporta skola","4171902078","Pastarpinātās pārvaldes iestāde","AGRIS KIMBORS",0,0,"Profesionālās ievirzes izglītības iestāde","Sporta skola","Kuldīgas novada Dome","Kuldīgas novada Dome",Nē,"DZIRNAVU IELA 13, KULDĪGA, KULDĪGAS NOVADS, LV-3301","63321944, 63321942","kuldiga.sp.skola@inbox.lv"
"Kuldīgas pirmsskolas izglītības iestāde ""Ābelīte""","4101901321","Pastarpinātās pārvaldes iestāde","RUTA ZIEMELE",0,0,"Pirmsskolas izglītības iestāde","Pirmsskolas izglītības iestāde","Kuldīgas novada Dome","Kuldīgas novada Dome",Nē,"ZIEDU IELA 15, KULDĪGA, KULDĪGAS NOVADS, LV-3301","63322510","bd.abelite@kuldiga.lv"
"Kuldīgas pirmsskolas izglītības iestāde ""Cīrulītis""","4101901424","Pastarpinātās pārvaldes iestāde","INGUNA KREBSE",0,0,"Pirmsskolas izglītības iestāde","Pirmsskolas izglītības iestāde","Kuldīgas novada Dome","Kuldīgas novada Dome",Nē,"PĻAVAS IELA 11, KULDĪGA, KULDĪGAS NOVADS, LV-3301","63324944","bd.cirulitis@kuldiga.lv"
"Kuldīgas Profesionālās tālākizglītības un pilnveides izglītības iestāde un uzņēmējdarbības atbalsta centrs ""METRO""","4160802290","Komercsabiedrības struktūrvienība","AIGA VAITKUS",0,0,"Profesionālās tālākizglītības un pilnveides izglītības iestāde","Profesionālās tālākizglītības un pilnveides izglītības iestāde","SIA ""ROYAL KEY""","SIA ""ROYAL KEY""",Nē,"LIEPĀJAS IELA 11 - 5, KULDĪGA, KULDĪGAS NOVADS, LV-3301","26464348","aiga@royalkeydesign.com"
"Kuldīgas Tehnoloģiju un tūrisma tehnikums","4134003008","Valsts tiešās pārvaldes iestāde","DACE CINE",0,0,"Profesionālās pamata un vidējās izglītības iestāde","Profesionālās izglītības kompetences centrs","Izglītības un zinātnes ministrija","Latvijas Republikas Ministru kabinets",Nē,"LIEPĀJAS IELA 31, KULDĪGA, KULDĪGAS NOVADS, LV-3301","63322570","kuldigasttt@pcabc.lv"
"Kultūrizglītības un mākslas centrs ""Kāpnes""","3360800665","Biedrība","EDGARS KRAMIŅŠ",0,0,"Profesionālās tālākizglītības un pilnveides izglītības iestāde","Profesionālās tālākizglītības un pilnveides izglītības iestāde","Edgars Kramiņš, Irēna Bauma, Marina Gubāte","Edgars Kramiņš, Irēna Bauma, Marina Gubāte",Nē,"BRUŅINIEKU IELA 33 - 9, CENTRA RAJONS, RĪGA, LV-1001","+371 26562579","info@vocalacademia.lv"
"Kusas pamatskola","4412900120","Pastarpinātās pārvaldes iestāde","AGRIS SĀRS",0,0,"Vispārējās izglītības iestāde","Vispārizglītojošā pamatskola","Madonas novada pašvaldība","Madonas novada Dome",Nē,"SKOLAS IELA 3, KUSA, ARONAS PAGASTS, MADONAS NOVADS, LV-4847","64829855","kusasskola@madona.lv"
"Ķeguma komercnovirziena vidusskola","4313900201","Pastarpinātās pārvaldes iestāde","VLADIMIRS SAMOHINS",0,0,"Vispārējās izglītības iestāde","Vispārizglītojošā vidusskola","Ķeguma novada pašvaldība","Ķeguma novada Dome",Nē,"SKOLAS IELA 10, ĶEGUMS, ĶEGUMA NOVADS, LV-5020","65055275","skola@kegumaskola.lv"
"Ķeguma novada Birzgales Vispārējā pirmsskolas izglītības iestāde ""Birztaliņa""","4301901459","Pastarpinātās pārvaldes iestāde","ANITA SKOSA",0,0,"Pirmsskolas izglītības iestāde","Pirmsskolas izglītības iestāde","Ķeguma novada pašvaldība","Ķeguma novada Dome",Nē,"JAUNATNES IELA 2, BIRZGALE, BIRZGALES PAGASTS, ĶEGUMA NOVADS, LV-5033","65034101","birztalina@kegums.lv"
"Ķeguma novada Vispārējā pirmsskolas izglītības iestāde ""Gaismiņa""","4301901456","Pastarpinātās pārvaldes iestāde","MĀRA ANDERSONE",0,0,"Pirmsskolas izglītības iestāde","Pirmsskolas izglītības iestāde","Ķeguma novada pašvaldība","Ķeguma novada Dome",Nē,"KOMUNĀLĀ IELA 7, ĶEGUMS, ĶEGUMA NOVADS, LV-5020","65038552 ","gaismina@kegums.lv"
"Ķeipenes pamatskola","4312900196","Pastarpinātās pārvaldes iestāde","AGNESE LEPSE",0,0,"Vispārējās izglītības iestāde","Vispārizglītojošā pamatskola","Ogres novada Dome","Ogres novada Dome",Nē,"ZIEDU IELA 3, ĶEIPENE, ĶEIPENES PAGASTS, OGRES NOVADS, LV-5062","65033695","keipenessk@ogresnovads.lv"
"Ķekavas Mākslas skola","4375902275","Pastarpinātās pārvaldes iestāde","INGA ZĀLĪTE-CĒRŪZE",0,0,"Profesionālās ievirzes izglītības iestāde","Mākslas skola","Ķekavas novada pašvaldība","Ķekavas novada Dome",Nē,"GAISMAS IELA 17, ĶEKAVA, ĶEKAVAS PAGASTS, ĶEKAVAS NOVADS, LV-2123","67937447","kekavas.makslasskola@kekava.lv"
"Ķekavas Mūzikas skola","4376902247","Pastarpinātās pārvaldes iestāde","DAIGA VENTNIECE",0,0,"Profesionālās ievirzes izglītības iestāde","Mūzikas skola","Ķekavas novada pašvaldība","Ķekavas novada Dome",Nē,"SKOLAS IELA 3, ĶEKAVA, ĶEKAVAS PAGASTS, ĶEKAVAS NOVADS, LV-2123","67937502","kekavas.muzikasskola@kekava.lv"
"Ķekavas novada pašvaldības pirmsskolas izglītības iestāde ""Avotiņš""","4301901831","Pastarpinātās pārvaldes iestāde","BAIBA JURISONE",0,0,"Pirmsskolas izglītības iestāde","Pirmsskolas izglītības iestāde","Ķekavas novada pašvaldība","Ķekavas novada Dome",Nē,"JAUNATNES IELA 3, BALOŽI, ĶEKAVAS NOVADS, LV-2112","67917719, 28352663","avotins@kekava.lv"
"Ķekavas novada pašvaldības pirmsskolas izglītības iestāde ""Ieviņa""","4301902002","Pastarpinātās pārvaldes iestāde","BIRUTA JOKSTE",0,0,"Pirmsskolas izglītības iestāde","Pirmsskolas izglītības iestāde","Ķekavas novada pašvaldība","Ķekavas novada Dome",Nē,"GAISMAS IELA 25, ĶEKAVA, ĶEKAVAS PAGASTS, ĶEKAVAS NOVADS, LV-2123","67937033","ievina@kekava.lv"
"Ķekavas novada pašvaldības pirmsskolas izglītības iestāde ""Zvaigznīte""","4301902003","Pastarpinātās pārvaldes iestāde","MAIJA UKSTIŅA",0,0,"Pirmsskolas izglītības iestāde","Pirmsskolas izglītības iestāde","Ķekavas novada pašvaldība","Ķekavas novada Dome",Nē,"JAUNATNES IELA 2, VALDLAUČI, ĶEKAVAS PAGASTS, ĶEKAVAS NOVADS, LV-1076","67620496, 67620284, 28370751","maijaukstina@inbox.lv"
"Ķekavas novada pirmsskolas izglītības iestāde ""Bitīte""","4301902814","Pastarpinātās pārvaldes iestāde","INESE SLOKA",0,0,"Pirmsskolas izglītības iestāde","Pirmsskolas izglītības iestāde","Ķekavas novada pašvaldība","Ķekavas novada pašvaldība",Nē,"Kazeņu iela 2, KATLAKALNS, ĶEKAVAS PAGASTS, ĶEKAVAS NOVADS, LV-2111","29469781","bitite@kekava.lv"
"Ķekavas novada sporta skola","4371902825","Pastarpinātās pārvaldes iestāde","INTS VANCĀNS",0,0,"Profesionālās ievirzes izglītības iestāde","Sporta skola","Ķekavas novada pašvaldība","Ķekavas novada Dome",Nē,"NĀKOTNES IELA 1A, ĶEKAVA, ĶEKAVAS PAGASTS, ĶEKAVAS NOVADS, LV-2123","29653457","sportaskola@kekava.lv"
"Ķekavas vidusskola","4313901079","Pastarpinātās pārvaldes iestāde","SANDRA PUGOVKA",0,0,"Vispārējās izglītības iestāde","Vispārizglītojošā vidusskola","Ķekavas novada pašvaldība","Ķekavas novada Dome",Nē,"GAISMAS IELA 9, ĶEKAVA, ĶEKAVAS PAGASTS, ĶEKAVAS NOVADS, LV-2123","67937196, 67937607","kekavas.vidusskola@kekava.lv"
"Ķemeru pamatskola","2912903110","Pastarpinātās pārvaldes iestāde","SVETLANA SEŅKINA",0,0,"Vispārējās izglītības iestāde","Vispārizglītojošā pamatskola","Jūrmalas pilsētas Dome","Jūrmalas pilsētas Dome",Nē,"TUKUMA IELA 10, JŪRMALA, LV-2012","67765520","kemerupsk@edu.jurmala.lv"
"Lāču pamatskola","4212900506","Pastarpinātās pārvaldes iestāde","ANDRIS MEŠKOVSKIS",0,0,"Vispārējās izglītības iestāde","Vispārizglītojošā pamatskola","Daugavpils novada Dome","Daugavpils novada Dome",Nē,"MUZEJA IELA 2, LOCIKI, NAUJENES PAGASTS, DAUGAVPILS NOVADS, LV-5458","65474565","skola@naujene.lv"
"Lādezera pamatskola","4312900167","Pastarpinātās pārvaldes iestāde","TAIGA PLITNIECE",0,0,"Vispārējās izglītības iestāde","Vispārizglītojošā pamatskola","Limbažu novada pašvaldība","Limbažu novada pašvaldība",Nē,"SKOLAS IELA 1, LĀDEZERS, LIMBAŽU PAGASTS, LIMBAŽU NOVADS, LV-4011","64071277 64071269 64071276","ladezera_ps@limbazi.lv"
"Laidu pamatskola","4112901184","Pastarpinātās pārvaldes iestāde","ELITA TISJAKA",0,0,"Vispārējās izglītības iestāde","Vispārizglītojošā pamatskola","Kuldīgas novada Dome","Kuldīgas novada Dome",Nē,"""LAIDU SKOLA"", LAIDI, LAIDU PAGASTS, KULDĪGAS NOVADS, LV-3317","63354472","laiduskola@kuldiga.lv"
"Laidzes pirmsskolas izglītības iestāde ""Papardīte""","4101901589","Pastarpinātās pārvaldes iestāde","SOLVEIGA DĀVIDSONE",0,0,"Pirmsskolas izglītības iestāde","Pirmsskolas izglītības iestāde","Talsu novada Dome","Talsu novada Dome",Nē,"""Bērnudārzs"", LAIDZE, LAIDZES PAGASTS, TALSU NOVADS, LV-3280","63221687","solveiga.davidsone@talsi.lv"
"Lapmežciema pamatskola","4312900208","Pastarpinātās pārvaldes iestāde","RAIMONDS ARĀJS",0,0,"Vispārējās izglītības iestāde","Vispārizglītojošā pamatskola","Engures novada pašvaldība","Engures novada Dome",Nē,"LIEPU IELA 2a, LAPMEŽCIEMS, LAPMEŽCIEMA PAGASTS, ENGURES NOVADS, LV-3118","26005864, 25553874","skola@lapmezciems.lv"
"Laterāna Pontifikālās Universitātes filiāle Rīgas Teoloģijas institūts","3345801789","Komercsabiedrība",,0,0,"Augstākās izglītības iestāde","Ārvalstu augstskolas filiāle","Rīgas Metropolijas Romas katoļu arhibīskaps Jānis Pujāts","Rīgas Metropolijas Romas katoļu arhibīskaps Jānis Pujāts",Nē,"KATOĻU IELA 16, LATGALES PRIEKŠPILSĒTA, RĪGA, LV-1003","26547971","rti.rgs@inbox.lv"
"Latgales priekšpilsētas mūzikas un mākslas skola","3374902983","Pastarpinātās pārvaldes iestāde","LINDA KŪLA",0,0,"Profesionālās ievirzes izglītības iestāde","Mūzikas un mākslas skola","Rīgas Dome","Rīgas Dome",Nē,"PRŪŠU IELA 13B, LATGALES PRIEKŠPILSĒTA, RĪGA, LV-1057","67474200","lpmums@riga.lv"
"Latgales profesionālās izglītības centrs","3160800885","Komercsabiedrības struktūrvienība","IĻJA KLIMANOVS",0,0,"Profesionālās tālākizglītības un pilnveides izglītības iestāde","Profesionālās tālākizglītības un pilnveides izglītības iestāde","Sabiedrība ar ierobežotu atbildību ""Latgales profesionālās izglītības centrs""","Sabiedrība ar ierobežotu atbildību ""Latgales profesionālās izglītības centrs""",Nē,"SKOLAS IELA 13 - 4, RĒZEKNE, LV-4601","27657875","lpic@inbox.lv"
"Latvija@Pasaule mācību centrs","3360800650","Biedrības struktūrvienība",,0,0,"Profesionālās tālākizglītības un pilnveides izglītības iestāde","Profesionālās tālākizglītības un pilnveides izglītības iestāde","Biedrība Latvijas Informācijas un komunikāciju tehnoloģijas asociācija","Biedrība Latvijas Informācijas un komunikāciju tehnoloģijas asociācija",Nē,"STABU IELA 47, RĪGA, LV-1011","67311821, 7314059","mc@likta.lv"
"Latvijas Aerobikas Asociācijas Mācību centrs ""Dzīves stils""","3360800314","Biedrības struktūrvienība",,0,0,"Profesionālās tālākizglītības un pilnveides izglītības iestāde","Profesionālās tālākizglītības un pilnveides izglītības iestāde","Biedrība LATVIJAS AEROBIKAS ASOCIĀCIJA","Biedrība LATVIJAS AEROBIKAS ASOCIĀCIJA",Nē,"ANNIŅMUIŽAS BULVĀRIS 40A, RĪGA, LV-1069","29133605","olga_k@tvnet.lv"
"Latvijas Alpīnistu un ceļotāju asociācijas Kalnu skola","3380802210","Biedrības struktūrvienība","EDGARS ŠĀBLIS",0,0,"Pieaugušo neformālās izglītības iestāde","Pieaugušo neformālās izglītības iestāde","Latvijas Alpīnistu un ceļotāju asociācija","Latvijas Alpīnistu un ceļotāju asociācija",Nē,"JĒKABPILS IELA 19a, LATGALES PRIEKŠPILSĒTA, RĪGA, LV-1003","67211159","laca@laca.lv"
"Latvijas Ambulatorās medicīnas māsu un sociālās aprūpes darbinieku asociācijas Izglītības centrs","3360800315","Biedrības struktūrvienība",,0,0,"Profesionālās tālākizglītības un pilnveides izglītības iestāde","Profesionālās tālākizglītības un pilnveides izglītības iestāde","Latvijas Ambulatorās medicīnas māsu un sociālās aprūpes darbinieku asociācija","Latvijas Ambulatorās medicīnas māsu un sociālās aprūpes darbinieku asociācija",Nē,"ŪNIJAS IELA 49, RĪGA, LV-1039","67816280","homecare@e-teliamtc.lv"
"Latvijas Brīvo arodbiedrību savienības Mācību centrs","3360800179","Juridiskā vai fiziskā persona ",,0,0,"Profesionālās tālākizglītības un pilnveides izglītības iestāde","Profesionālās tālākizglītības un pilnveides izglītības iestāde","Latvijas Brīvo arodbiedrību savienība","Latvijas Brīvo arodbiedrību savienība",Nē,"BRUŅINIEKU IELA 29/31, CENTRA RAJONS, RĪGA, LV-1001","67035912  67035914","lbaseduc@latnet.lv"
"Latvijas Ģimenes plānošanas un seksuālās veselības asociācijas ""Papardes zieds"" mācību centrs","3360800448","Biedrības struktūrvienība",,0,0,"Profesionālās tālākizglītības un pilnveides izglītības iestāde","Profesionālās tālākizglītības un pilnveides izglītības iestāde","Latvijas Ģimenes plānošanas un seksuālās veselības asociācija ""Papardes zieds""","Latvijas Ģimenes plānošanas un seksuālās veselības asociācija ""Papardes zieds""",Nē,"GRĒCINIEKU IELA 34, RĪGA, LV-1050","67212700","papardeszieds@apollo.lv"
"Latvijas Jūras akadēmija","3343001281","Atvasināta publiskā persona ","KRISTĪNE CARJOVA",0,0,"Augstākās izglītības iestāde","Augstskola","Izglītības un zinātnes ministrija","Latvijas Republikas Ministru kabinets",Nē,"FLOTES IELA 12 k-1, KURZEMES RAJONS, RĪGA, LV-1016","67161125","info@latja.lv"
"Latvijas Jūras akadēmijas Jūrskola","3331002482","Valsts tiešās pārvaldes iestāde","ARNIS BANKOVIČS",0,0,"Profesionālās pamata un vidējās izglītības iestāde","Profesionālās vidējās izglītības iestāde","Izglītības un zinātnes ministrija","Latvijas Jūras akadēmija",Nē,"FLOTES IELA 12 k-1, KURZEMES RAJONS, RĪGA, LV-1016"," 67161121","info@latja.lv"
"Latvijas Kinoloģiskā federācija","3360800310","Biedrība",,0,0,"Profesionālās tālākizglītības un pilnveides izglītības iestāde","Profesionālās tālākizglītības un pilnveides izglītības iestāde","Latvijas Kinoloģiskie klubi","Latvijas Kinoloģiskie klubi",Nē,"ELIJAS IELA 21, RĪGA, LV-1050","67614819","lkf@open.lv"
"LATVIJAS KRISTĪGĀ AKADĒMIJA","2943801398","Komercsabiedrība","SKAIDRĪTE GŪTMANE",0,0,"Augstākās izglītības iestāde","Augstskola","Skaidrīte Alma Gūtmane","Skaidrīte Alma Gūtmane",Nē,"VIENĪBAS PROSPEKTS 23, JŪRMALA, LV-2010","67753360","akademija@kra.lv"
"Latvijas Kultūras akadēmija","3342301524","Atvasināta publiskā persona ","RŪTA MUKTUPĀVELA",0,0,"Augstākās izglītības iestāde","Augstskola","Kultūras ministrija","Latvijas Republikas Ministru kabinets",Nē,"LUDZAS IELA 24, LATGALES PRIEKŠPILSĒTA, RĪGA, LV-1003","67140175","admin@lka.edu.lv"
"Latvijas Kultūras akadēmijas aģentūra ""Latvijas Kultūras akadēmijas Latvijas Kultūras koledža""","3347302312","Pastarpinātās pārvaldes iestāde","SANDRA PLOTA",0,0,"Augstākās izglītības iestāde","Koledža","Latvijas Kultūras akadēmija","Latvijas Kultūras akadēmija",Nē,"BRUŅINIEKU IELA 57, LATGALES PRIEKŠPILSĒTA, RĪGA, LV-1011","67846238 ","lkk@lkk.gov.lv"
"Latvijas Lauksaimniecības universitāte","2841101568","Atvasināta publiskā persona ","IRINA PILVERE",0,0,"Augstākās izglītības iestāde","Augstskola","Zemkopības ministrija","Latvijas Republikas Ministru kabinets",Nē,"LIELĀ IELA 2, JELGAVA, LV-3001","63005601","rektors@llu.lv"
"Latvijas Mākslas akadēmija","3342301471","Atvasināta publiskā persona ","KRISTAPS ZARIŅŠ",1,0,"Augstākās izglītības iestāde","Augstskola","Kultūras ministrija","Latvijas Republikas Ministru kabinets",Nē,"KALPAKA BULVĀRIS 13, CENTRA RAJONS, RĪGA, LV-1867","67332202","info@lma.lv"
